{
  "$schema": "https://json-schema.org/draft/2020-12/schema",
  "title": "goal",
  "description": "research/GOAL.json (BRIEF 6.4, Implementation Decisions 10): the quantitative goal, written by intake only when its eval_command printed the metric on a sample artifact. Every key is present; a value the owner did not state is null, never a guess.",
  "type": "object",
  "required": ["metric", "direction", "target", "dataset_or_split", "held_out_split", "eval_command", "baseline", "budget", "stop_when"],
  "additionalProperties": false,
  "properties": {
    "metric": {"type": "string", "pattern": "\\S", "description": "the name the eval command prints the value under"},
    "direction": {"type": "string", "enum": ["up", "down"], "description": "up when a larger value is better"},
    "target": {"type": "number"},
    "dataset_or_split": {"type": ["string", "null"], "description": "the data the metric is computed on"},
    "held_out_split": {"type": ["string", "null"], "description": "the split a kept change must improve on (the keep-if-better loop)"},
    "eval_command": {"type": "string", "pattern": "\\S", "description": "a shell command run from the project root; {artifact} is replaced by the artifact's path, which is also exported as WAYLINE_ARTIFACT, and {split} by held_out_split, also exported as WAYLINE_HELD_OUT_SPLIT; keep-if-better runs it once per seed artifact (ticket 39)"},
    "baseline": {
      "oneOf": [
        {
          "type": "object",
          "required": ["value", "source"],
          "additionalProperties": false,
          "properties": {"value": {"type": "null"}, "source": {"type": "null"}}
        },
        {
          "type": "object",
          "required": ["value", "source"],
          "additionalProperties": false,
          "properties": {
            "value": {"type": "number"},
            "source": {"type": "string", "pattern": "\\S", "description": "where the number comes from: a paper, a result file, a run"}
          }
        }
      ]
    },
    "budget": {
      "type": "object",
      "required": ["gpu_hours", "wallclock", "usage_windows"],
      "additionalProperties": false,
      "properties": {
        "gpu_hours": {"type": ["number", "null"], "minimum": 0},
        "wallclock": {"type": ["number", "null"], "minimum": 0, "description": "hours"},
        "usage_windows": {"type": ["integer", "null"], "minimum": 0}
      }
    },
    "stop_when": {"type": "string", "enum": ["goal_reached", "graph_empty"]}
  }
}
