{
  "metric": "auroc",
  "direction": "up",
  "target": 0.02,
  "dataset_or_split": null,
  "held_out_split": "split_b",
  "eval_command": "python3 toy/eval.py {artifact}",
  "baseline": {
    "value": null,
    "source": null
  },
  "budget": {
    "gpu_hours": null,
    "wallclock": 4,
    "usage_windows": null
  },
  "stop_when": "goal_reached"
}
